{
  "schema_version": "0.3.0",
  "artifact_type": "diagnosis_report",
  "artifact_id": "diagnosis_demo_001",
  "run_id": "run_demo_001",
  "iteration": 0,
  "producer": "reporter",
  "mode": "development",
  "created_at": "2026-10-07T02:00:00Z",
  "status": "completed",
  "input_refs": [
    {
      "artifact_id": "candidates_demo_001",
      "artifact_type": "vulnerability_candidates",
      "iteration": 0,
      "path": "artifacts/iteration-000/access_analyzer/vulnerability_candidates.json",
      "sha256": "7a6c85de8c616f4d5657dc69ba37445ec2ecd718c4654d12873e386915ebc11e"
    },
    {
      "artifact_id": "scenarios_demo_001",
      "artifact_type": "test_scenarios",
      "iteration": 0,
      "path": "artifacts/iteration-000/scenario_generator/test_scenarios.json",
      "sha256": "e31f1ef9052a0e135e92abd1090aa4b0b5115ef7e50a75995f6f8729b7ebd9ec"
    },
    {
      "artifact_id": "decisions_demo_001",
      "artifact_type": "safety_decisions",
      "iteration": 0,
      "path": "artifacts/iteration-000/safety_policy/safety_decisions.json",
      "sha256": "0b1c099d6c62847582971a06531413e4f74d671c0878384f6aa02351b4c71140"
    },
    {
      "artifact_id": "verification_demo_001",
      "artifact_type": "verification_results",
      "iteration": 0,
      "path": "artifacts/iteration-000/verifier/verification_results.json",
      "sha256": "a591baf6677b6cea3792046824948d19cc9c17102d992ea5675dca923480f77a"
    }
  ],
  "errors": [],
  "runtime_metrics": {
    "duration_ms": 10,
    "llm_calls": 0,
    "input_tokens": 0,
    "output_tokens": 0,
    "peak_memory_mb": 32
  },
  "data": {
    "target_url": "http://127.0.0.1:8001/",
    "summary": {
      "candidate_count": 3,
      "confirmed_count": 1,
      "not_confirmed_count": 0,
      "suspected_count": 0,
      "indeterminate_count": 1,
      "policy_blocked_count": 0,
      "approval_pending_count": 1
    },
    "findings": [
      {
        "finding_id": "finding_idor_001",
        "candidate_id": "candidate_idor_001",
        "scenario_id": "scenario_idor_001",
        "verification_id": "verification_idor_001",
        "category": "authorization",
        "vulnerability_type": "horizontal_access",
        "status": "confirmed",
        "title": "다른 사용자 주문 조회",
        "description": "정책 근거가 있는 위반이 실제 실행에서 재현됨",
        "evidence_refs": [
          {
            "evidence_id": "verification_idor_response",
            "kind": "response",
            "path": "evidence/verifier/verification_idor_response.json",
            "sha256": "eeeeeeeeeeeeeeeeeeeeeeeeeeeeeeeeeeeeeeeeeeeeeeeeeeeeeeeeeeeeeeee",
            "redacted": true
          }
        ]
      },
      {
        "finding_id": "finding_workflow_001",
        "candidate_id": "candidate_workflow_001",
        "scenario_id": "scenario_workflow_001",
        "verification_id": "verification_workflow_001",
        "category": "business_logic",
        "vulnerability_type": "workflow_step_bypass",
        "status": "approval_pending",
        "title": "주문 상태 변경 승인 대기",
        "description": "상태 변경 가능성으로 사용자 승인을 기다리는 중",
        "evidence_refs": []
      },
      {
        "finding_id": "finding_unplanned_001",
        "candidate_id": "candidate_unplanned_001",
        "scenario_id": null,
        "verification_id": null,
        "category": "authorization",
        "vulnerability_type": "role_escalation",
        "status": "indeterminate",
        "title": "검증 계획이 없는 권한 상승 후보",
        "description": "시나리오가 생성되지 않아 판단할 수 없음",
        "evidence_refs": [
          {
            "evidence_id": "candidate_observation",
            "kind": "response",
            "path": "evidence/verifier/candidate_observation.json",
            "sha256": "eeeeeeeeeeeeeeeeeeeeeeeeeeeeeeeeeeeeeeeeeeeeeeeeeeeeeeeeeeeeeeee",
            "redacted": true
          }
        ]
      }
    ],
    "limitations": [
      "candidate_unplanned_001은 시나리오가 없어 검증하지 못함"
    ]
  }
}
